{
  "kind": "aurora.cyclic-workflow",
  "schemaVersion": { "major": 1, "minor": 0, "lifecycle": "preview" },
  "documentId": "018f0000-0000-7000-8000-000000000200",
  "workflowId": "018f0000-0000-7000-8000-000000000201",
  "canonicalName": "schema_node_catalog",
  "permanent": true,
  "nodes": [
    { "nodeId": "018f0000-0000-7000-8000-000000000202", "canonicalName": "entry", "kind": "Entry" },
    { "nodeId": "018f0000-0000-7000-8000-000000000203", "canonicalName": "action", "kind": "Action", "executionOrder": 0, "cancellationBoundary": false },
    { "nodeId": "018f0000-0000-7000-8000-000000000204", "canonicalName": "decision", "kind": "Decision", "executionOrder": 1, "cancellationBoundary": false },
    { "nodeId": "018f0000-0000-7000-8000-000000000205", "canonicalName": "fork", "kind": "Fork", "executionOrder": 2, "cancellationBoundary": false },
    { "nodeId": "018f0000-0000-7000-8000-000000000206", "canonicalName": "merge", "kind": "Join", "executionOrder": 3, "cancellationBoundary": false, "mode": "merge" },
    { "nodeId": "018f0000-0000-7000-8000-000000000207", "canonicalName": "join_all", "kind": "Join", "executionOrder": 4, "cancellationBoundary": false, "mode": "join-all", "forkId": "018f0000-0000-7000-8000-000000000205" },
    { "nodeId": "018f0000-0000-7000-8000-000000000208", "canonicalName": "join_any", "kind": "Join", "executionOrder": 5, "cancellationBoundary": false, "mode": "join-any", "forkId": "018f0000-0000-7000-8000-000000000205", "loserPolicy": "cancel-others" },
    { "nodeId": "018f0000-0000-7000-8000-000000000209", "canonicalName": "cycle_wait", "kind": "Wait", "executionOrder": 6, "cancellationBoundary": false, "mode": "cycles", "waitCycles": 1 },
    { "nodeId": "018f0000-0000-7000-8000-000000000210", "canonicalName": "timed_wait", "kind": "Wait", "executionOrder": 7, "cancellationBoundary": false, "mode": "condition", "conditionId": "018f0000-0000-7000-8000-000000000211", "timeoutCycles": 1 },
    { "nodeId": "018f0000-0000-7000-8000-000000000212", "canonicalName": "permanent_wait", "kind": "Wait", "executionOrder": 8, "cancellationBoundary": false, "mode": "condition", "conditionId": "018f0000-0000-7000-8000-000000000213", "permanent": true },
    { "nodeId": "018f0000-0000-7000-8000-000000000214", "canonicalName": "subworkflow", "kind": "Subworkflow", "executionOrder": 9, "cancellationBoundary": false, "targetWorkflowId": "018f0000-0000-7000-8000-000000000215" },
    { "nodeId": "018f0000-0000-7000-8000-000000000216", "canonicalName": "end", "kind": "End" }
  ],
  "edges": [
    { "edgeId": "018f0000-0000-7000-8000-000000000217", "kind": "control", "sourceNodeId": "018f0000-0000-7000-8000-000000000202", "targetNodeId": "018f0000-0000-7000-8000-000000000216", "backedge": false }
  ]
}
